{
  "schema_version": "1.0.0",
  "experiment_id": "synthetic-ab-machinery-validation-v1",
  "synthetic_example": true,
  "predeclaration": {
    "declared_at": "2026-08-20T00:00:00Z",
    "declared_by": "repository validation harness",
    "outcomes_viewed_at_declaration": false,
    "locked_fields": [
      "hypothesis",
      "population",
      "assignment",
      "primary_metric",
      "inference",
      "sample_size",
      "stopping_rule",
      "decision_rule",
      "guardrails"
    ]
  },
  "hypothesis": {
    "null": "The treatment-control difference in mean per-user CTR is zero.",
    "alternative": "The treatment-control difference in mean per-user CTR is non-zero.",
    "sidedness": "two_sided"
  },
  "population": {
    "eligibility": "Synthetic users generated by the deterministic validation harness.",
    "randomization_unit": "user_id"
  },
  "assignment": {
    "arms": [
      "control",
      "treatment"
    ],
    "algorithm": "sha256_64bit_threshold_v1",
    "salt_id": "reco-engine-adv/synthetic-validation/v1",
    "treatment_fraction": 0.5
  },
  "primary_metric": {
    "name": "per-user click-through rate",
    "numerator": "clicks recorded for an eligible user during the experiment window",
    "denominator": "eligible impressions recorded for that user during the experiment window",
    "aggregation": "equal_weight_per_user",
    "analysis_unit": "user_id",
    "missing_data_rule": "Exclude users with zero eligible impressions; do not impute outcomes."
  },
  "inference": {
    "method": "welch_t_test",
    "alpha": 0.05,
    "confidence_level": 0.95,
    "multiplicity_policy": "one_primary_metric_no_multiplicity_adjustment"
  },
  "sample_size": {
    "planned_total_users": 800,
    "minimum_users_per_arm": 300,
    "minimum_detectable_absolute_effect": 0.03,
    "target_power": 0.8,
    "planning_assumptions": "Synthetic baseline CTR 0.10, repeated impressions within users, and equal allocation."
  },
  "stopping_rule": {
    "type": "fixed_horizon",
    "analysis_trigger": "planned_total_users_reached",
    "early_efficacy_stopping": "none",
    "early_futility_stopping": "none",
    "max_primary_analyses": 1
  },
  "decision_rule": {
    "reject_null_when": "two_sided_p_value_below_alpha",
    "effect_reporting": "absolute_difference_with_confidence_interval",
    "srm_action": "invalidate_primary_decision_and_investigate"
  },
  "guardrails": [
    {
      "name": "sample ratio mismatch",
      "failure_condition": "Allocation goodness-of-fit p-value is below 0.001.",
      "action": "Invalidate the primary decision and investigate assignment or logging."
    }
  ]
}
